[
  {
    "name": "Grottes de Lacan",
    "category": "archaeology",
    "lat": 45.138,
    "lng": 1.549,
    "description": "Prehistoric shelters along the Correze river, evidence of habitation at the start of the route.",
    "links": [],
    "nearest_km": 0.03,
    "nearest_distance_m": 47
  },
  {
    "name": "Distillerie Denoix",
    "category": "food",
    "lat": 45.1589,
    "lng": 1.5335,
    "description": "Historic liqueur distillery (est. 1839) producing walnut liqueur and violet mustard. Free tastings.",
    "links": [
      {
        "url": "https://www.denoix.com/",
        "label": "Official site"
      }
    ],
    "nearest_km": 0.0,
    "nearest_distance_m": 2607
  },
  {
    "name": "Marche de Brive",
    "category": "market",
    "lat": 45.159,
    "lng": 1.534,
    "description": "Major covered market (Tue/Thu/Sat). Famous Foires Grasses truffle and foie gras markets Nov-Feb.",
    "links": [
      {
        "url": "https://fr.wikipedia.org/wiki/Halle_Georges-Brassens_(Brive-la-Gaillarde)",
        "label": "Wikipedia (fr)"
      }
    ],
    "nearest_km": 0.0,
    "nearest_distance_m": 2598
  },
  {
    "name": "Musee Edmond Michelet",
    "category": "museum",
    "lat": 45.157,
    "lng": 1.532,
    "description": "WWII Resistance museum in the house where Michelet distributed anti-Nazi tracts on June 17, 1940.",
    "links": [
      {
        "url": "https://en.wikipedia.org/wiki/Edmond_Michelet",
        "label": "Wikipedia"
      }
    ],
    "nearest_km": 0.0,
    "nearest_distance_m": 2486
  },
  {
    "name": "Domaine de la Gardelle",
    "category": "food",
    "lat": 45.12,
    "lng": 1.51,
    "description": "Organic vineyard producing Correze PDO wines including traditional vin paille (straw wine).",
    "links": [],
    "nearest_km": 1.85,
    "nearest_distance_m": 3504
  },
  {
    "name": "Grottes de Lamouroux",
    "category": "archaeology",
    "lat": 45.1598,
    "lng": 1.5347,
    "description": "Troglodytic cliff dwellings carved into limestone, inhabited from prehistoric through medieval times.",
    "links": [
      {
        "url": "https://fr.wikipedia.org/wiki/Grottes_de_Lamouroux",
        "label": "Wikipedia (fr)"
      }
    ],
    "nearest_km": 0.0,
    "nearest_distance_m": 2653
  },
  {
    "name": "Aubazine Abbey",
    "category": "abbey",
    "lat": 45.175,
    "lng": 1.669,
    "description": "12th-century Cistercian abbey where Coco Chanel spent six years as an orphan. Geometric patterns may have inspired the Chanel logo.",
    "links": [
      {
        "url": "https://en.wikipedia.org/wiki/Aubazine_Abbey",
        "label": "Wikipedia"
      }
    ],
    "nearest_km": 38.9,
    "nearest_distance_m": 4716
  },
  {
    "name": "Chateau de Turenne",
    "category": "castle",
    "lat": 45.0537,
    "lng": 1.583,
    "description": "Ruined hilltop keep of the Viscounty of Turenne. Controlled much of Correze until sold to Louis XV in 1738.",
    "links": [
      {
        "url": "https://en.wikipedia.org/wiki/Turenne",
        "label": "Wikipedia"
      }
    ],
    "nearest_km": 11.91,
    "nearest_distance_m": 91
  },
  {
    "name": "Eglise Saint-Pierre",
    "category": "church",
    "lat": 45.0607,
    "lng": 1.6555,
    "description": "11th-century fortified church in Collonges-la-Rouge with carved Romanesque tympanum depicting the Ascension.",
    "links": [
      {
        "url": "https://fr.wikipedia.org/wiki/%C3%89glise_Saint-Pierre_de_Collonges-la-Rouge",
        "label": "Wikipedia (fr)"
      }
    ],
    "nearest_km": 21.79,
    "nearest_distance_m": 101
  },
  {
    "name": "Castel de Vassinhac",
    "category": "castle",
    "lat": 45.061,
    "lng": 1.656,
    "description": "Late 16th-century fortified manor in Collonges-la-Rouge with distinctive turrets and loopholes.",
    "links": [
      {
        "url": "https://fr.wikipedia.org/wiki/Castel_de_Vassinhac",
        "label": "Wikipedia (fr)"
      }
    ],
    "nearest_km": 21.82,
    "nearest_distance_m": 52
  },
  {
    "name": "Maison de la Sirene",
    "category": "museum",
    "lat": 45.0608,
    "lng": 1.655,
    "description": "16th-century house with sculpted mermaid in Collonges. Once belonged to Henry de Jouvenel, husband of Colette.",
    "links": [
      {
        "url": "https://fr.wikipedia.org/wiki/Maison_de_la_Sir%C3%A8ne",
        "label": "Wikipedia (fr)"
      }
    ],
    "nearest_km": 21.77,
    "nearest_distance_m": 114
  },
  {
    "name": "Beynat Chestnut Festival",
    "category": "food",
    "lat": 45.125,
    "lng": 1.728,
    "description": "Annual October Fete de la Chataigne. Chestnut producers, tastings, and summer Tuesday evening markets.",
    "links": [
      {
        "url": "https://www.festivalenfrance.com/en/festival/beynat-chestnut-and-marron-festival",
        "label": "Festival info"
      }
    ],
    "nearest_km": 45.19,
    "nearest_distance_m": 60
  },
  {
    "name": "Fromagerie Duroux",
    "category": "cheese",
    "lat": 45.16643,
    "lng": 2.19865,
    "description": "Artisan fromagerie at 12 Route de Chaussenac, Rilhac-Xaintrie (eastern Corrèze, in the Xaintrie). Ages cheese in a reconverted railway tunnel. Produces Pavé Corrézien. Not on the Stage 9 route — closest approach is ~33 km north of the fromagerie at km 50.5.",
    "links": [
      {
        "url": "https://www.fromagerie-duroux.fr/",
        "label": "Official site"
      },
      {
        "url": "https://www.fromagerie-duroux.fr/pave-correzien/",
        "label": "Pavé Corrézien"
      }
    ],
    "nearest_km": 50.51,
    "nearest_distance_m": 32834,
    "source": "https://www.fromagerie-duroux.fr/ (official site address: 12 Route de Chaussenac, 19220 Rilhac-Xaintrie)"
  },
  {
    "name": "Église Saint-Martial de Sainte-Fortunade",
    "category": "church",
    "lat": 45.20727,
    "lng": 1.77188,
    "description": "Parish church holding the relic of Sainte Fortunade, a third-century martyr of Agen whose remains arrived in 894. The early-fifteenth-century reliquary bust still sits in the church.",
    "links": [
      {
        "url": "https://fr.wikipedia.org/wiki/%C3%89glise_Saint-Martial_de_Sainte-Fortunade",
        "label": "Wikipédia"
      },
      {
        "url": "https://www.ste-fortunade.fr/notre-commune/histoire-et-patrimoine/",
        "label": "Histoire et patrimoine de la commune"
      }
    ],
    "nearest_km": 60.01,
    "nearest_distance_m": 76,
    "source": "https://www.wikidata.org/wiki/Q38513255"
  },
  {
    "name": "Château de Sainte-Fortunade",
    "category": "castle",
    "lat": 45.20744,
    "lng": 1.77155,
    "description": "Fifteenth-century motte-castle remodelled in the nineteenth century, bought by the commune in 1952 and now housing the mairie. A round tower with machicolations remains.",
    "links": [
      {
        "url": "https://www.ste-fortunade.fr/notre-commune/histoire-et-patrimoine/",
        "label": "Commune history page"
      }
    ],
    "nearest_km": 60.03,
    "nearest_distance_m": 45,
    "source": "https://www.wikidata.org/wiki/Q22996042"
  },
  {
    "name": "Cascades de Gimel",
    "category": "nature",
    "lat": 45.297,
    "lng": 1.853,
    "description": "Three waterfalls on the Montane river with a total drop of 143m. Natura 2000 site north of Tulle.",
    "links": [
      {
        "url": "https://www.cascadesdegimel.com/",
        "label": "Official site"
      }
    ],
    "nearest_km": 74.44,
    "nearest_distance_m": 4301
  },
  {
    "name": "Cathedrale Notre-Dame de Tulle",
    "category": "church",
    "lat": 45.268,
    "lng": 1.768,
    "description": "12th-century cathedral with a 73m bell tower, the tallest in the Limousin. Notable carved cloister.",
    "links": [
      {
        "url": "https://en.wikipedia.org/wiki/Tulle_Cathedral",
        "label": "Wikipedia"
      },
      {
        "url": "https://fr.wikipedia.org/wiki/Cath%C3%A9drale_Notre-Dame_de_Tulle",
        "label": "Wikipedia (fr)"
      }
    ],
    "nearest_km": 68.6,
    "nearest_distance_m": 311
  },
  {
    "name": "Cite de l'Accordeon",
    "category": "museum",
    "lat": 45.2685,
    "lng": 1.7695,
    "description": "Opened 2024 in the former Banque de France. Exhibits on accordion-making, Tulle lace, and arms manufacturing.",
    "links": [
      {
        "url": "https://www.citedelaccordeon.com/",
        "label": "Official site"
      }
    ],
    "nearest_km": 68.79,
    "nearest_distance_m": 233
  },
  {
    "name": "Les Delices de Mel",
    "category": "cheese",
    "lat": 45.268,
    "lng": 1.77,
    "description": "Fromagerie in central Tulle. Regional cheeses including Feuille du Limousin, caillade, and cabecou.",
    "links": [
      {
        "url": "https://www.lesdelicesdemel.fr/",
        "label": "Official site"
      }
    ],
    "nearest_km": 68.69,
    "nearest_distance_m": 177
  },
  {
    "name": "Marche de Tulle",
    "category": "market",
    "lat": 45.268,
    "lng": 1.769,
    "description": "Wednesday and Saturday morning market at Place Gambetta and Quai Baluze along the Correze river.",
    "links": [
      {
        "url": "https://prieurecorreze.com/en/excursion/tulle-market/",
        "label": "Visitor guide"
      }
    ],
    "nearest_km": 68.66,
    "nearest_distance_m": 245
  },
  {
    "name": "Tintignac Gallo-Roman Sanctuary",
    "category": "archaeology",
    "lat": 45.3056,
    "lng": 1.7667,
    "description": "Celtic bronze carnyx war trumpets discovered 2004. One of the most important Celtic finds in France. Fanum temple and theatre.",
    "links": [
      {
        "url": "https://en.wikipedia.org/wiki/Tintignac",
        "label": "Wikipedia"
      }
    ],
    "nearest_km": 77.66,
    "nearest_distance_m": 656
  },
  {
    "name": "Chateau de Bach",
    "category": "castle",
    "lat": 45.31,
    "lng": 1.76,
    "description": "Castle near Naves with an 18th-century portal and vestiges of a 14th-century Gothic cloister.",
    "links": [
      {